{
  "schema": "frontier-lifecycle/1.0",
  "candidate_id": "economic.live-settlement/v1",
  "subject_class": "capability-family",
  "lifecycle": "frontier",
  "canonical_owner_refs": ["works-execution","trust-gateway","aie"],
  "claims": ["live-settlement semantics are under frontier evaluation"],
  "non_claims": ["production-safe live settlement","custody","autonomous spending"],
  "contract_refs": ["economic-graph-capabilities/1.0"],
  "evidence_refs": [],
  "verifier_refs": [],
  "gate_ref": null,
  "registry_evidence_ref": null,
  "self_promoted": false,
  "carries_authority": false
}
